{
  "schemaVersion": "1.0.0",
  "manifestType": "figma-source-manifest",
  "createdAt": "2026-05-08T00:00:00Z",
  "pageKey": "home-v1",
  "documentName": "Pococo",
  "figmaPage": {
    "id": "11944",
    "name": "Home V1"
  },
  "desktopFrame": {
    "id": "11944:1933",
    "name": "SECTIONS",
    "figma": {
      "fileKey": "8ZeaG0uv832dg4Gn7HonGC",
      "pageId": "11944",
      "pageName": "Home V1",
      "nodeId": "11944:1933",
      "nodeUrl": "https://www.figma.com/design/8ZeaG0uv832dg4Gn7HonGC/Pococo?node-id=11944-1933&m=dev"
    },
    "canvas": {
      "width": 1600,
      "height": 8939.3203125
    }
  },
  "mobileFrame": {
    "id": "11944:1934",
    "name": "SECTIONS",
    "figma": {
      "fileKey": "8ZeaG0uv832dg4Gn7HonGC",
      "pageId": "11944",
      "pageName": "Home V1",
      "nodeId": "11944:1934",
      "nodeUrl": "https://www.figma.com/design/8ZeaG0uv832dg4Gn7HonGC/Pococo?node-id=11944-1934&m=dev"
    },
    "canvas": {
      "width": 414,
      "height": 10516.9873046875
    }
  },
  "workflow": {
    "pageInitializationSkill": "skills/theme/initialize-page-from-figma/SKILL.md",
    "deliveryScope": "section-only",
    "acceptanceScope": "section",
    "visualBaselineSource": "figma-rest-asset-manifest",
    "evidenceManifestPath": "design-assets/manifest.json"
  },
  "harnessTarget": {
    "mode": "installed-theme",
    "themeRoot": ".",
    "harnessRoot": "harness",
    "starterRoot": "starter",
    "requiredThemeFiles": [
      "layout/theme.liquid",
      "assets/kik-theme.css",
      "assets/kik-component.js"
    ]
  },
  "tokenSource": {
    "kind": "figma-variables2css",
    "rawPath": "design-tokens/figma.variables2css.css",
    "writePolicy": "manual-if-missing",
    "syncCommand": "make sync-kik-tokens TOKENS=design-tokens/figma.variables2css.css"
  },
  "pairingMode": "order-fallback",
  "pairingConfidence": "high",
  "sectionTreeHash": "sha256:3e8f1d5ac8c0b2b79cc1083765829e75d18edf96ae66452f3235415c0f043306",
  "sectionIds": [
    "hero-section",
    "reviews-and-pr-mentions",
    "why-pococo-section",
    "featured-products",
    "how-it-is-works",
    "use-scenarios",
    "pococo-vs-competitor",
    "discs-products",
    "benefit-section-tabs",
    "about-us",
    "blog-tips",
    "trust-badges",
    "footer"
  ],
  "sections": [
    {
      "id": "hero-section",
      "name": "Hero Section",
      "order": 1,
      "slotIndex": 1,
      "suggestedHandle": "hero-section",
      "sectionType": "theme-section",
      "dataSourceKind": "none",
      "skillRouting": {
        "recommendedSkill": "skills/theme/implement-section-from-figma/SKILL.md",
        "reason": "Static brand hero \u2014 no Shopify data binding indicated."
      },
      "source": {
        "desktop": {
          "nodeId": "11928:8842",
          "nodeName": "Hero Section",
          "declaredSectionId": null,
          "dimensions": {
            "x": 0,
            "y": 0,
            "width": 1600,
            "height": 700
          },
          "figma": {
            "fileKey": "8ZeaG0uv832dg4Gn7HonGC",
            "pageId": "11944",
            "pageName": "Home V1",
            "nodeId": "11928:8842",
            "nodeUrl": "https://www.figma.com/design/8ZeaG0uv832dg4Gn7HonGC/Pococo?node-id=11928-8842&m=dev"
          }
        },
        "mobile": {
          "nodeId": "11928:7873",
          "nodeName": "Hero Section",
          "declaredSectionId": null,
          "dimensions": {
            "x": 0,
            "y": 0,
            "width": 414,
            "height": 670
          },
          "figma": {
            "fileKey": "8ZeaG0uv832dg4Gn7HonGC",
            "pageId": "11944",
            "pageName": "Home V1",
            "nodeId": "11928:7873",
            "nodeUrl": "https://www.figma.com/design/8ZeaG0uv832dg4Gn7HonGC/Pococo?node-id=11928-7873&m=dev"
          }
        }
      }
    },
    {
      "id": "reviews-and-pr-mentions",
      "name": "Reviews & PR Mentions",
      "order": 2,
      "slotIndex": 2,
      "suggestedHandle": "reviews-and-pr-mentions",
      "sectionType": "theme-section",
      "dataSourceKind": "none",
      "skillRouting": {
        "recommendedSkill": "skills/theme/implement-section-from-figma/SKILL.md",
        "reason": "Static testimonial / PR strip \u2014 content is brand-owned copy."
      },
      "source": {
        "desktop": {
          "nodeId": "11928:7884",
          "nodeName": "Reviews & PR Mentions",
          "declaredSectionId": null,
          "dimensions": {
            "x": 0,
            "y": 700,
            "width": 1600,
            "height": 95
          },
          "figma": {
            "fileKey": "8ZeaG0uv832dg4Gn7HonGC",
            "pageId": "11944",
            "pageName": "Home V1",
            "nodeId": "11928:7884",
            "nodeUrl": "https://www.figma.com/design/8ZeaG0uv832dg4Gn7HonGC/Pococo?node-id=11928-7884&m=dev"
          }
        },
        "mobile": {
          "nodeId": "11928:6915",
          "nodeName": "Reviews & PR Mentions",
          "declaredSectionId": null,
          "dimensions": {
            "x": 0,
            "y": 670,
            "width": 414,
            "height": 134.00003051757812
          },
          "figma": {
            "fileKey": "8ZeaG0uv832dg4Gn7HonGC",
            "pageId": "11944",
            "pageName": "Home V1",
            "nodeId": "11928:6915",
            "nodeUrl": "https://www.figma.com/design/8ZeaG0uv832dg4Gn7HonGC/Pococo?node-id=11928-6915&m=dev"
          }
        }
      }
    },
    {
      "id": "why-pococo-section",
      "name": "Why Pococo Section",
      "order": 3,
      "slotIndex": 3,
      "suggestedHandle": "why-pococo-section",
      "sectionType": "theme-section",
      "dataSourceKind": "none",
      "skillRouting": {
        "recommendedSkill": "skills/theme/implement-section-from-figma/SKILL.md",
        "reason": "Static feature highlights \u2014 block-driven editorial content."
      },
      "source": {
        "desktop": {
          "nodeId": "11928:7961",
          "nodeName": "Why Pococo Section",
          "declaredSectionId": null,
          "dimensions": {
            "x": 0,
            "y": 795,
            "width": 1600,
            "height": 674.1875
          },
          "figma": {
            "fileKey": "8ZeaG0uv832dg4Gn7HonGC",
            "pageId": "11944",
            "pageName": "Home V1",
            "nodeId": "11928:7961",
            "nodeUrl": "https://www.figma.com/design/8ZeaG0uv832dg4Gn7HonGC/Pococo?node-id=11928-7961&m=dev"
          }
        },
        "mobile": {
          "nodeId": "11928:6992",
          "nodeName": "Why Pococo Section",
          "declaredSectionId": null,
          "dimensions": {
            "x": 0,
            "y": 804,
            "width": 414,
            "height": 1794.351318359375
          },
          "figma": {
            "fileKey": "8ZeaG0uv832dg4Gn7HonGC",
            "pageId": "11944",
            "pageName": "Home V1",
            "nodeId": "11928:6992",
            "nodeUrl": "https://www.figma.com/design/8ZeaG0uv832dg4Gn7HonGC/Pococo?node-id=11928-6992&m=dev"
          }
        }
      }
    },
    {
      "id": "featured-products",
      "name": "Featured Products",
      "order": 4,
      "slotIndex": 4,
      "suggestedHandle": "featured-products",
      "sectionType": "product-data-section",
      "dataSourceKind": "product",
      "skillRouting": {
        "recommendedSkill": "skills/theme/implement-shopify-data-section-from-figma/SKILL.md",
        "reason": "Shows concrete products; bind to selected Shopify products."
      },
      "source": {
        "desktop": {
          "nodeId": "11928:7986",
          "nodeName": "Featured Products",
          "declaredSectionId": null,
          "dimensions": {
            "x": 0,
            "y": 1469.1875,
            "width": 1600,
            "height": 991
          },
          "figma": {
            "fileKey": "8ZeaG0uv832dg4Gn7HonGC",
            "pageId": "11944",
            "pageName": "Home V1",
            "nodeId": "11928:7986",
            "nodeUrl": "https://www.figma.com/design/8ZeaG0uv832dg4Gn7HonGC/Pococo?node-id=11928-7986&m=dev"
          }
        },
        "mobile": {
          "nodeId": "11928:7017",
          "nodeName": "Featured Products",
          "declaredSectionId": null,
          "dimensions": {
            "x": 0,
            "y": 2598.351318359375,
            "width": 414,
            "height": 1219
          },
          "figma": {
            "fileKey": "8ZeaG0uv832dg4Gn7HonGC",
            "pageId": "11944",
            "pageName": "Home V1",
            "nodeId": "11928:7017",
            "nodeUrl": "https://www.figma.com/design/8ZeaG0uv832dg4Gn7HonGC/Pococo?node-id=11928-7017&m=dev"
          }
        }
      }
    },
    {
      "id": "how-it-is-works",
      "name": "How It Is Works",
      "order": 5,
      "slotIndex": 5,
      "suggestedHandle": "how-it-is-works",
      "sectionType": "theme-section",
      "dataSourceKind": "none",
      "skillRouting": {
        "recommendedSkill": "skills/theme/implement-section-from-figma/SKILL.md",
        "reason": "Editorial step-by-step \u2014 static blocks."
      },
      "source": {
        "desktop": {
          "nodeId": "11928:8346",
          "nodeName": "How It Is Works",
          "declaredSectionId": null,
          "dimensions": {
            "x": 0,
            "y": 2460.1875,
            "width": 1600,
            "height": 896
          },
          "figma": {
            "fileKey": "8ZeaG0uv832dg4Gn7HonGC",
            "pageId": "11944",
            "pageName": "Home V1",
            "nodeId": "11928:8346",
            "nodeUrl": "https://www.figma.com/design/8ZeaG0uv832dg4Gn7HonGC/Pococo?node-id=11928-8346&m=dev"
          }
        },
        "mobile": {
          "nodeId": "11928:7379",
          "nodeName": "How It Is Works",
          "declaredSectionId": null,
          "dimensions": {
            "x": 0,